сумма руб эскалации заключение андеррайтинг;;;;;;;;;;;;;;4;;;;;6;;;;2;;;;;;;;;;3;12
сумма ставка кредит рефинансирование одобрить;;;;;;;;;;;;;;;;;;;;;;5;;;;;;;;;;;1;5
сумма стратегия мультипликатор являться ошибка;;;;;1;1;;;;;;;19;;;;;;;;;;;;;;;;;;;;3;21
сумма стратегия обязательство мультипликатор вычет;;;;;;;;;;;;;;22;;;;;;;;;;;;;;;;;;;1;22
тверской рг московский физический лицо;;;;;;;;;;;;;;;;;;;;;;;;;;;;;;;;9;1;9
транзакт УКО статус сбол отказ;;4;;;;;;;;;;;;;;;;;;;;;;;;;;;;;;;0;0
транзакт отказ кредит статус ошибка;;;;;10;;;;;;;;;266;;;;;;;;;;;;;;;;;;;2;276
транзакт ошибка работа проблема кредит;;;;;;;;;;;;;;;;;;;;;;;;;;;;157;;;;;1;157
требоваться номер нужный сжк привязка;;;;;;;;;;;;;;;;;;;;;;;;;2;;;;;;;;1;2
требоваться пересоздание профиль должностных обязанность;;;;;;;;;;;;;;;;;;;;;;;;;;;12;6;;;;;2;18
требоваться привязка среднерусский переназначать видеть;;;;;;;;;;;;;;;;;;;;;;;;7;6;5;1;;;;;;4;19
уважение анкетных контрагент апатиты заблокироваться;;;;;;;;;;;;;;;;;;;;;2;;;;;;;;;;;;1;2
уважение установка стратегия аудит внутренний;;;;;;;;;;;;;;;;;;;;;;;;128;;;;;;;;;1;128
увеличение максимальной прямым терять независимо;;;;;;;;;;;;;;;;;;;;;;;;;96;;;;;;;;1;96
удалённый составление собираться часы кидать;;;;;;;;;;;;;;;;;;;;;;;;;;57;;;;;;;1;57
управление аппарат увольнение отделение закрытие;;;;;;;;;;;;;;;;;;;;;;;;;;;8;;;;;;1;8
управление закрытие аппарат доступ закрыть;;;;;;;;;;;;;33;;;;;;;;;;;;;;;;;;;;1;33
управление продажа закрытие сектор аппарат;;;;;;;;;;;;;;;;;;;;;;;;;;4;;;;;;;1;4
установка направлять установить стратегии факт;;;1;;;;;;;;;;;;;;;;;;;;;;;;;;;;;;0;0
установка стратегия направлять стратегии получение;;;;;;;;;;;;;;;;;;;;;;141;;;;;;;;;;;1;141
установка стратегия пром_nbsm часы экстренно;;;;;;;;;;;;;;;;;;;;;;;;;;107;1;2;;;;;3;110
установка стратегия сохраниться перезагрузить кузнецкий;;;;;;;;;;;;;;;;;;;;;;;;;;;;;;;;1;1;1
установка стратегия ханты-мансийского ивановское память;;;;;;;;;;;;;;;;;;;;;;;;;;;;;;;2;;1;2
уходить ЕКП обработка статус ошибка;3;;;;;;;;;;;;;;;;;;;;;;;;;;;;;;;;0;0
уходить обработка а0 возвращаться отправить;;;;;;;;;;;;;;;;;;;;9;;1;;2;;;;;;;;;3;12
уходить обработка анкета проблема решение;;;;;;;11;;;;;;;;;;;;;;;;;;;;;;;;;;1;11
уходить обработка возвращаться помочь решение;;;;;;;;;;;;;;;;;;17;3;;;;;;;;;;;;;;2;20
файл прикрепить ошибка скрин выходить;;;;;;;;;;;;;;;;;;3;1;;2;;;;;;;;;;;;3;6
формирование кредит выдать кредитного договор;2;;;;;;;;;;;;;;;;;;;;;;;;;;;;;;;;0;0
фотоальбом выходить ошибка досье документ;;;;;;;;;;;;;;;;;;;;;2;;;;;;;;;;;;1;2
фотоальбом документ ошибка досье кредитный;;;;;;;;;;;;;;;;;177;47;22;;;;;;;;;;;;;;3;246
фотоальбом ошибка обработка документ кредитный;;;;;;;;;;;;;;;;;;;;53;;3;;;;;;;;;;;2;56
фп кассовый пришлый сбол программа;;13;;;;;;;;;;;;;;;;;;;;;;;;;;;;;;;0;0
центр доступ подразделение закрытие центральный;;;;;5;;1;;;;;;;;;;;;;;;;;;;;;;;;;;2;6
центр закрытие подчинение центральный управление;;;;;;;;;;;;;;7;;;;;;;;;;;;;;;;;;;1;7
центр подчинение центральный региональный закрытие;;;;;;;;;;;;;;;;;5;1;;;4;1;1;4;4;;;;;1;;6;9;27
центр риск розничного подчинение закрытие;;;;;;;;;;;;19;;;;;;;;;;;;;;;;;;;;;1;19
центр розничного подчинение закрытие центральный;10;8;;;;;;;;;;;;;;;;;;;;;;;;;;;;;;;0;0
центр сопровождение подчинение центральный региональный;;;;;;;;;;;;;;;;1;;;3;5;;;;;;;;;;;;;3;9
центр центральный подчинение закрытие закрыть;;;;;;;;;;;;;;;;;;;;;;;;;;;10;;;;1;;2;11
центрально-чернозёмный народный СБ бульвар производственный;;;;;;;;;;;;;;;;;;;;;;;;;;;;;;;;1;1;1
центральный подчинение центр закрытие доступ;;;;;;;;;;;;;;;;;;;;;;;;;;3;;7;2;;;;3;12
цзк ЕРКЦ декрет верификатор бэк;;;;;;;;;;;;;;;;;;;;13;;;;;;;;;;;;;1;13
цпо кредитный премьер кмсп отделение;;;;;;;;;;;;;;;;;;;;;;;;;;;;;;;;7;1;7
цпо отделение модель ролевой премьер;;;;;;;;;;;;;;;;;;8;;;;;;;;;;;;;;;1;8
цпо персонального премьер кмсп кредитный;;;;;;;;;;;;;13;9;1;;5;;;;;;;;6;;;;1;;;;6;35
цпо премьер кмсп кредитный персонального;;;;;;;;;;;;;;;;;;;;;;;;;;;;;;;16;;1;16
шапка пришлый затем высвечиваться логинписать;;9;;;;;;;;;;;;;;;;;;;;;;;;;;;;;;;0;0
экспертиза риск розничного межрегиональный подчинение;;;;;;;;;;;;;;;;;;;1;;;;;;;6;4;4;;;;4;5;19
юр юридический рг специализированный московский;;10;;;;;;;;;;;;;;;;;;;;;;;;;;;;;;;0;0
